{
  "jurisdiction": "UK",
  "jurisdiction_name": "United Kingdom (Great Britain)",
  "product_category": "packaged_food",
  "pack_version": "2026-08-31.1",
  "retrieved_on": "2026-08-31",
  "scope_note": "Selected mandatory label particulars for prepacked food sold in Great Britain, taken from current GOV.UK and Food Standards Agency business guidance on the Food Information Regulations 2014 and assimilated Regulation (EU) No 1169/2011. This pack is a bounded MVP subset. Prepacked for direct sale rules, Northern Ireland specific requirements, and product specific compositional standards are out of scope.",
  "sources": [
    {
      "source_id": "GOVUK-FIC-GUIDE",
      "name": "Food labelling: giving food information to consumers",
      "publisher": "GOV.UK (Department for Environment, Food and Rural Affairs)",
      "url": "https://www.gov.uk/guidance/food-labelling-giving-food-information-to-consumers",
      "retrieved_on": "2026-08-31"
    },
    {
      "source_id": "GOVUK-LABEL-SHOW",
      "name": "Food labelling and packaging: what you must show",
      "publisher": "GOV.UK",
      "url": "https://www.gov.uk/food-labelling-and-packaging/food-labelling-what-you-must-show",
      "retrieved_on": "2026-08-31"
    },
    {
      "source_id": "GOVUK-INGREDIENTS",
      "name": "Food labelling and packaging: ingredients list",
      "publisher": "GOV.UK",
      "url": "https://www.gov.uk/food-labelling-and-packaging/ingredients-list",
      "retrieved_on": "2026-08-31"
    },
    {
      "source_id": "GOVUK-WARNINGS",
      "name": "Food labelling and packaging: food and drink warnings",
      "publisher": "GOV.UK",
      "url": "https://www.gov.uk/food-labelling-and-packaging/food-and-drink-warnings",
      "retrieved_on": "2026-08-31"
    },
    {
      "source_id": "FSA-ALLERGEN-TG",
      "name": "Food allergen labelling and information requirements technical guidance",
      "publisher": "Food Standards Agency",
      "url": "https://www.food.gov.uk/business-guidance/allergen-guidance-for-food-businesses",
      "retrieved_on": "2026-08-31"
    },
    {
      "source_id": "GOVUK-NUTRITION",
      "name": "Food labelling and packaging: nutrition, health claims and supplement labelling",
      "publisher": "GOV.UK",
      "url": "https://www.gov.uk/food-labelling-and-packaging/nutrition-health-claims-and-supplement-labelling",
      "retrieved_on": "2026-08-31"
    }
  ],
  "rules": [
    {
      "rule_id": "RULE-UK-FOOD-001",
      "jurisdiction": "UK",
      "category": "identity",
      "requirement": "The label must show the name of the food.",
      "severity": "critical",
      "source_id": "GOVUK-LABEL-SHOW",
      "source_reference": "Food labelling and packaging: what you must show",
      "source_excerpt": "the name of the food",
      "applicability": {"summary": "All prepacked food.", "always_applies": true},
      "validation_type": "text",
      "required_facts": ["product_name"],
      "evidence_hint": "Descriptive product name on the front panel. A brand name alone is not the name of the food.",
      "suggested_fix": "Show a customary or descriptive name of the food on the label."
    },
    {
      "rule_id": "RULE-UK-FOOD-002",
      "jurisdiction": "UK",
      "category": "ingredients",
      "requirement": "Where the product has two or more ingredients, all ingredients must be listed in descending order by weight.",
      "severity": "critical",
      "source_id": "GOVUK-INGREDIENTS",
      "source_reference": "Food labelling and packaging: ingredients list",
      "source_excerpt": "If your food or drink product has 2 or more ingredients (including water and additives), you must list them all.",
      "applicability": {
        "summary": "Prepacked food with two or more ingredients.",
        "always_applies": false,
        "conditions": [{"fact": "single_ingredient_food", "operator": "equals", "value": false}]
      },
      "validation_type": "text",
      "required_facts": ["ingredients_text", "ingredients_list"],
      "evidence_hint": "Ingredients heading followed by the list, heaviest ingredient first.",
      "suggested_fix": "Add a full ingredients list in descending order of weight.",
      "notes": "The MVP checks that a full ingredients list is present with more than one ingredient. It cannot verify true manufacturing weights, so it does not independently confirm the printed order is actually descending by weight; it only checks that a percentage shown on the first listed ingredient, if any, is plausible as the largest component."
    },
    {
      "rule_id": "RULE-UK-FOOD-003",
      "jurisdiction": "UK",
      "category": "allergens",
      "requirement": "Any of the 14 regulated allergens present must be named in the ingredients list and emphasised so they stand out from the rest of the list.",
      "severity": "critical",
      "source_id": "GOVUK-INGREDIENTS",
      "source_reference": "Food labelling and packaging: ingredients list, allergen emphasis",
      "source_excerpt": "You must highlight allergens on the label using a different font, style or background colour.",
      "applicability": {
        "summary": "Where the product contains one or more of the 14 allergens listed in assimilated Regulation (EU) No 1169/2011 Annex II.",
        "always_applies": false,
        "conditions": [{"fact": "contains_listed_allergen", "operator": "is_true"}]
      },
      "validation_type": "hybrid",
      "required_facts": ["ingredients_list", "emphasised_allergens", "allergen_statement"],
      "evidence_hint": "Allergen words inside the ingredients list shown in bold, capitals, underline or a contrasting background. A separate Contains box is not a substitute for emphasis in the list.",
      "suggested_fix": "Emphasise each regulated allergen inside the ingredients list, for example in bold.",
      "notes": "The 14 allergens are celery, cereals containing gluten, crustaceans, eggs, fish, lupin, milk, molluscs, mustard, nuts, peanuts, sesame, soya and sulphur dioxide or sulphites above 10 mg/kg or 10 mg/l."
    },
    {
      "rule_id": "RULE-UK-FOOD-004",
      "jurisdiction": "UK",
      "category": "quantity",
      "requirement": "The label must show the net quantity of the food by weight or volume.",
      "severity": "critical",
      "source_id": "GOVUK-LABEL-SHOW",
      "source_reference": "Food labelling and packaging: what you must show",
      "source_excerpt": "net quantity information",
      "applicability": {"summary": "All prepacked food.", "always_applies": true},
      "validation_type": "text",
      "required_facts": ["net_quantity"],
      "evidence_hint": "Quantity such as 250g or 500ml, normally in the same field of vision as the name.",
      "suggested_fix": "Declare net quantity in metric units on the label."
    },
    {
      "rule_id": "RULE-UK-FOOD-005",
      "jurisdiction": "UK",
      "category": "date_marking",
      "requirement": "The label must show a best before or use by date where one is required, and a use by date must be used where there is a safety issue with eating the food after that date.",
      "severity": "critical",
      "source_id": "GOVUK-FIC-GUIDE",
      "source_reference": "Food labelling: giving food information to consumers, date marking",
      "source_excerpt": "Only show a 'use by' date where there's a safety issue with eating the food after this date. It's a criminal offence to sell food that's past its 'use by' date.",
      "applicability": {
        "summary": "Prepacked food that requires a date mark. A small number of categories such as fresh fruit and vegetables, wine and salt are exempt.",
        "always_applies": false,
        "conditions": [{"fact": "date_marking_exempt_category", "operator": "equals", "value": false}]
      },
      "validation_type": "text",
      "required_facts": ["best_before_date", "use_by_date"],
      "evidence_hint": "Best before or use by date printed on the pack, with the date or a pointer to where the date is shown.",
      "suggested_fix": "Print a best before or use by date, choosing use by where the food is highly perishable.",
      "notes": "The MVP checks that at least one of a best before or use by date is present. It does not independently judge whether the food has a safety-related shelf life that specifically requires a use by date rather than best before."
    },
    {
      "rule_id": "RULE-UK-FOOD-006",
      "jurisdiction": "UK",
      "category": "business_info",
      "requirement": "The label must show the name and address of the food business operator under whose name the food is marketed, or of the importer, and for food sold in Great Britain this must be a UK address.",
      "severity": "high",
      "source_id": "GOVUK-FIC-GUIDE",
      "source_reference": "Food labelling: giving food information to consumers, name and address of the food business operator",
      "source_excerpt": "This must be either: the name of the business whose name the food is marketed under ... the address of the business that has imported the food. From 1 January 2024 pre-packaged food or caseins sold in GB must include a UK address for the FBO.",
      "applicability": {"summary": "All prepacked food sold in Great Britain.", "always_applies": true},
      "validation_type": "text",
      "required_facts": ["business_name_address", "importer_name_address"],
      "evidence_hint": "Address block on the back or side panel including a UK address and postcode.",
      "suggested_fix": "Add the food business operator name with a full UK address.",
      "notes": "The MVP checks that a name and address block is present for the food business operator or importer. It does not independently verify that the address is genuinely within the UK."
    },
    {
      "rule_id": "RULE-UK-FOOD-007",
      "jurisdiction": "UK",
      "category": "usage",